{
  "$schema": "https://json-schema.org/draft/2020-12/schema",
  "$id": "https://chp.dev/schemas/v0.2/mandate.schema.json",
  "title": "Mandate",
  "description": "A principal's signed grant of bounded authority to a delegate (chp-v0.2.md section 10, proposal 0002): 'delegate D may invoke capabilities in SCOPE on my behalf until VALID_UNTIL'. The signature covers the canonical header {kind, mandate_id, delegate_id, scope, valid_from, valid_until, created_at, canonicalization}; the principal's host-identity attestation (with optional anchors) rides inside, so 'whose authority' resolves through the same trust roots as evidence bundles. A mandate narrows and attributes - transport auth still gates the connection.",
  "type": "object",
  "required": [
    "kind",
    "mandate_id",
    "delegate_id",
    "scope",
    "valid_from",
    "valid_until",
    "created_at",
    "canonicalization",
    "principal",
    "signature"
  ],
  "additionalProperties": false,
  "properties": {
    "kind": {
      "const": "mandate"
    },
    "mandate_id": {
      "type": "string",
      "minLength": 1
    },
    "delegate_id": {
      "type": "string",
      "minLength": 1,
      "description": "The identity the principal is authorizing (the acting host/agent's caller name)."
    },
    "scope": {
      "type": "array",
      "minItems": 1,
      "items": {
        "type": "string",
        "minLength": 1
      },
      "description": "Capability scope entries in the http-binding section-2 grammar: an exact capability id, or a trailing-* prefix (e.g. chp.adapters.audit.*). Sorted at signing time (canonical bytes)."
    },
    "valid_from": {
      "type": "string"
    },
    "valid_until": {
      "type": "string",
      "description": "Mandates MUST expire - unbounded authority is what this object replaces."
    },
    "created_at": {
      "type": "string"
    },
    "canonicalization": {
      "const": "chp-stable-v1"
    },
    "depth": {
      "type": "integer",
      "minimum": 1,
      "description": "Sub-delegation (chp-v0.2.md section 10, proposal 0009): chain depth, root omits it (depth 0), each attenuating link increments. Signed-header field, present only when parent_id is set."
    },
    "parent_id": {
      "type": "string",
      "minLength": 1,
      "description": "Sub-delegation: the mandate_id of the parent this link attenuates. Signed-header field. The embedded 'parent' MUST have this mandate_id."
    },
    "parent": {
      "$ref": "#",
      "description": "Sub-delegation: the full parent mandate embedded inline (recursive). Carried as transport (verified on its own signature); the child commits to it via the signed parent_id and the delegate join (parent.delegate_id == this.principal.host_id). A child may only NARROW scope and SHORTEN the window."
    },
    "principal": {
      "type": "object",
      "required": [
        "host_id",
        "public_key",
        "host_identity"
      ],
      "additionalProperties": false,
      "properties": {
        "host_id": {
          "type": "string"
        },
        "public_key": {
          "type": "string",
          "description": "base64 raw ed25519 public key"
        },
        "host_identity": {
          "type": "object",
          "description": "Self-signed host-identity attestation (chp-v0.2.md §3). 'anchors' is omitted entirely when empty (§3.1 byte rule).",
          "required": [
            "host_id",
            "public_key",
            "key_id",
            "valid_from",
            "signature"
          ],
          "additionalProperties": false,
          "properties": {
            "host_id": {
              "type": "string"
            },
            "public_key": {
              "type": "string"
            },
            "key_id": {
              "type": "string"
            },
            "valid_from": {
              "type": "string"
            },
            "valid_until": {
              "type": [
                "string",
                "null"
              ]
            },
            "anchors": {
              "type": "array",
              "minItems": 1,
              "items": {
                "type": "object",
                "required": [
                  "type"
                ],
                "properties": {
                  "type": {
                    "type": "string"
                  }
                },
                "additionalProperties": true
              },
              "description": "External trust roots vouching for this key, e.g. {\"type\":\"domain\",\"domain\":\"acme.example\"}. MUST be omitted when empty."
            },
            "signature": {
              "type": "string"
            }
          }
        },
        "key_history": {
          "type": "array",
          "description": "OPTIONAL rotation lineage (spec section 3.2): continuity statements, each signed by the OLD key it names. Omitted when empty.",
          "items": {
            "type": "object"
          }
        }
      }
    },
    "signature": {
      "type": "object",
      "required": [
        "algorithm",
        "key_id",
        "signature"
      ],
      "additionalProperties": false,
      "properties": {
        "algorithm": {
          "const": "ed25519"
        },
        "key_id": {
          "type": "string"
        },
        "signature": {
          "type": "string"
        }
      }
    }
  }
}
