{
  "canonicalization": "chp-stable-v1",
  "created_at": "2026-01-01T00:00:00Z",
  "delegate_id": "vector-subdelegate",
  "depth": 1,
  "kind": "mandate",
  "mandate_id": "mnd_fixture0002",
  "parent": {
    "canonicalization": "chp-stable-v1",
    "created_at": "2026-01-01T00:00:00Z",
    "delegable": true,
    "delegate_id": "vector-delegate",
    "kind": "mandate",
    "mandate_id": "mnd_fixture0001",
    "principal": {
      "host_id": "vector-principal",
      "host_identity": {
        "host_id": "vector-principal",
        "key_id": "56475aa75463474c",
        "public_key": "A6EHv/POEL4dcN0Y50vAmWfk1jCbpQ1fHdyGZBJVMbg=",
        "signature": "9UK1v4awGFYfZCYQARD8orzkbwS3Y2i3P0eZVBBUlIv7VCwNmGDqtw3KuZkFd8Go6bsiVq5cghrLUSYrZmzjBg==",
        "valid_from": "2026-01-01T00:00:00Z",
        "valid_until": null
      },
      "public_key": "A6EHv/POEL4dcN0Y50vAmWfk1jCbpQ1fHdyGZBJVMbg="
    },
    "scope": [
      "chp.adapters.audit.*",
      "demo.echo"
    ],
    "signature": {
      "algorithm": "ed25519",
      "key_id": "56475aa75463474c",
      "signature": "9LgFrKWHekiTyoCnWq0O0kJ7jxVrDr6jC3IkSKUBWuXCDZEjZwqlR2WqBcH3WCi8pypwjNkF2UzzARa/nP3mBA=="
    },
    "valid_from": "2026-01-01T00:00:00Z",
    "valid_until": "2027-01-01T00:00:00Z"
  },
  "parent_id": "mnd_fixture0001",
  "principal": {
    "host_id": "vector-delegate",
    "host_identity": {
      "host_id": "vector-delegate",
      "key_id": "03396219237f75a6",
      "public_key": "JUO5L/EJVRFHatyDadtt3JM2ZaEZeN2hQE7hBmypVZ0=",
      "signature": "AZeyU3hLEUKJqkPllCIDkVOnNhKMM8opISh796RgyLoff0ejuqk2fciZBjsmDoY/549bzSG3sOBkp+xn2cb1CA==",
      "valid_from": "2026-01-01T00:00:00Z",
      "valid_until": null
    },
    "public_key": "JUO5L/EJVRFHatyDadtt3JM2ZaEZeN2hQE7hBmypVZ0="
  },
  "scope": [
    "demo.echo"
  ],
  "signature": {
    "algorithm": "ed25519",
    "key_id": "03396219237f75a6",
    "signature": "AYA5yZ6+1ODWxdkZ/M8Oeqh+tv8imt+u1DeXLS6yg1fQnzf+T/a7L6jToXQZevF2Pvsu1G+v3xw+piOYG8ZFAQ=="
  },
  "valid_from": "2026-01-01T00:00:00Z",
  "valid_until": "2026-06-01T00:00:00Z"
}
